{"$schema":"https://json-schema.org/draft/2020-12/schema","title":"StoryDesk optional adapter conformance fixture","type":"object","additionalProperties":true,"required":["schema_version","adapter_kind","adapter_id","records"],"properties":{"schema_version":{"const":"1.0.0"},"adapter_kind":{"enum":["identity","scheduling"]},"adapter_id":{"type":"string","pattern":"^[a-z][a-z0-9-]{2,127}$"},"records":{"type":"array","minItems":1,"maxItems":1000,"items":{"type":"object"}}}}
